section_id,headline,artifact_anchor,coordination_note,result_label
wave71_rollup,Wave71 closed: External validation diagnostic refresh + demo + exploration closure,results/figures/wave71_exploration_baseline_closure_card.md,experimental/frontier coordination only; gold baseline untouched.,experimental/frontier
external_validation_coordination,External validation separation-harm diagnostic refresh coordinated after Wave71 closure,results/figures/wave71_external_validation_narrow_slice_coordination_card.md,Diagnostic scope only; attribution claims still blocked.,experimental/frontier
demo_wave71,Demo presentation polish extended to 72 sections under qualitative/demo labeling,results/figures/demo_wave71_presentation_writeback.md,No live demo or benchmark timing claims.,qualitative/demo
frontier_board,Frontier go/no-go board remains all_ready after Wave71 chain,results/tables/frontier_go_no_go_summary.json,Coordination receipts only; no deployable routing claims.,experimental/frontier
wave72_boundary,MeetEval official narrow dry-run coordination is the next open coordination gate,results/figures/meeteval_cpwer_tokenization_gain_scorecard_summary.md,Wave72 closure does not record overlap-case embedding execution sessions.,experimental/frontier
