section_id,headline,artifact_anchor,coordination_note,result_label
wave27_rollup,Wave27 closed: LightOverlap diagnostic refresh + demo + exploration closure,results/figures/wave27_exploration_baseline_closure_card.md,experimental/frontier coordination only; gold baseline untouched.,experimental/frontier
lightoverlap_coordination,LightOverlap separation-harm diagnostic refresh coordinated after Wave27 closure,results/figures/wave27_speaker_profile_lightoverlap_diagnostic_coordination_card.md,Diagnostic scope only; attribution claims still blocked.,experimental/frontier
demo_wave27,Demo presentation polish extended to 28 sections under qualitative/demo labeling,results/figures/demo_wave27_presentation_writeback.md,No live demo or benchmark timing claims.,qualitative/demo
frontier_board,Frontier go/no-go board remains all_ready after Wave27 chain,results/tables/frontier_go_no_go_summary.json,Coordination receipts only; no deployable routing claims.,experimental/frontier
wave28_boundary,Speaker profile MidOverlap diagnostic refresh is the next open experimental coordination gate,results/tables/speaker_profile_status.json,Wave28 closure does not record overlap-case embedding execution sessions.,experimental/frontier
