section_id,headline,artifact_anchor,coordination_note,result_label
midoverlap_diagnostic_scope,MidOverlap separation-harm diagnostic scope refresh after Wave140 closure,results/figures/separation_phase_diagram.md,Separation harms ASR on this gold anchor; diagnostic-only — no attribution claim.,experimental/frontier
midoverlap_prior,Wave9 MidOverlap diagnostic coordination remains the prerequisite chain,results/figures/speaker_profile_midoverlap_diagnostic_coordination_card.md,Wave86 refresh does not replace original MidOverlap boundary documentation.,experimental/frontier
wave134_refresh,Wave134 MidOverlap diagnostic refresh precedes Wave140 refresh,results/figures/wave134_speaker_profile_midoverlap_diagnostic_coordination_card.md,Prior wave refresh provides chain for cyclic overlap diagnostic coordination.,experimental/frontier
lightoverlap_refresh,Wave139 LightOverlap diagnostic refresh precedes MidOverlap refresh,results/figures/wave139_speaker_profile_lightoverlap_diagnostic_coordination_card.md,Overlap diagnostic chain progresses LightOverlap → MidOverlap through coordinated refreshes.,experimental/frontier
wave140_boundary,Wave140 closure defers overlap embedding execution to diagnostic boundaries only,results/figures/wave140_exploration_baseline_closure_card.md,Gold baseline CER tables unchanged; attribution still blocked.,experimental/frontier
