section_id,headline,artifact_anchor,coordination_note,result_label
midoverlap_diagnostic_scope,MidOverlap separation-harm diagnostic scope refresh after Wave146 closure,results/figures/separation_phase_diagram.md,Separation harms ASR on this gold anchor; diagnostic-only — no attribution claim.,experimental/frontier
midoverlap_prior,Wave9 MidOverlap diagnostic coordination remains the prerequisite chain,results/figures/speaker_profile_midoverlap_diagnostic_coordination_card.md,Wave86 refresh does not replace original MidOverlap boundary documentation.,experimental/frontier
wave140_refresh,Wave140 MidOverlap diagnostic refresh precedes Wave146 refresh,results/figures/wave140_speaker_profile_midoverlap_diagnostic_coordination_card.md,Prior wave refresh provides chain for cyclic overlap diagnostic coordination.,experimental/frontier
lightoverlap_refresh,Wave145 LightOverlap diagnostic refresh precedes MidOverlap refresh,results/figures/wave145_speaker_profile_lightoverlap_diagnostic_coordination_card.md,Overlap diagnostic chain progresses LightOverlap → MidOverlap through coordinated refreshes.,experimental/frontier
wave146_boundary,Wave146 closure defers overlap embedding execution to diagnostic boundaries only,results/figures/wave146_exploration_baseline_closure_card.md,Gold baseline CER tables unchanged; attribution still blocked.,experimental/frontier
