section_id,headline,artifact_anchor,coordination_note,result_label
wave12_rollup,Wave12 closed: LLM critic dry-run + HeavyOverlap diagnostic + demo + exploration closure,results/figures/wave12_exploration_baseline_closure_card.md,experimental/frontier coordination only; gold baseline untouched.,experimental/frontier
llm_critic_dry_run,LLM critic qualitative narrow dry-run coordinated on 5/5 gold cases,results/figures/llm_critic_narrow_dry_run_coordination_card.md,Verified repair claims still blocked.,qualitative/demo
heavyoverlap_diagnostic,HeavyOverlap separation-benefit diagnostic scope coordinated,results/figures/speaker_profile_heavyoverlap_diagnostic_coordination_card.md,OppositeOverlap remains deferred; attribution still blocked.,experimental/frontier
frontier_all_ready,Five-track frontier board remains 5/5 go,results/tables/frontier_go_no_go_summary.json,Coordination rollup; does not claim frontier execution completion.,experimental/frontier
wave13_boundary,Controlled cascade benchmark timing remains the primary open experimental gate,results/tables/cascade_benchmark_manifest_template.csv,Wave13 closure does not record controlled hardware benchmark sessions.,experimental/frontier
